{
  "format": "touchline-hub",
  "version": 1,
  "hubId": "22222222-2222-4222-8222-222222222222",
  "name": "Fixture hub",
  "hubOrigin": "https://learn.example.org",
  "backend": {
    "type": "supabase",
    "url": "https://fixture.supabase.co",
    "publishableKey": "sb_publishable_fixture_not_a_real_key"
  },
  "contracts": {
    "snapshot": 1,
    "progress": 1
  },
  "auth": {
    "email": "otp",
    "providers": [
      "google",
      "apple"
    ]
  }
}
